{
  "$schema": "https://json-schema.org/draft/2020-12/schema",
  "$id": "https://raw.githubusercontent.com/SoylentAquamarine/AI-Model-Catalog/main/schema/catalog-index.schema.json",
  "title": "AI Model Catalog index",
  "description": "The discovery entry point. Consumers fetch this first, then the provider files it lists. Consumers must ignore fields they do not recognize.",
  "type": "object",
  "required": ["schemaVersion", "generatedAt", "providers"],
  "properties": {
    "schemaVersion": {
      "type": "string",
      "pattern": "^[0-9]+\\.[0-9]+\\.[0-9]+$"
    },
    "generatedAt": {
      "type": "string",
      "description": "UTC ISO 8601 timestamp of the build that produced this index. Consumers can compare it to their last sync and skip downloads when unchanged."
    },
    "totalModels": {
      "type": "integer",
      "description": "Sum of modelCount across all providers (added in 1.1.0)."
    },
    "totalFreeModels": {
      "type": "integer",
      "description": "Count of models with costClass=free across all providers (added in 1.1.0). This catalog is free-only, so it equals totalModels."
    },
    "capabilitySummary": {
      "type": "object",
      "description": "Per-capability count of models whose support was verified by a live catalog test (added in 1.4.0). See capabilities.json for the model lists.",
      "additionalProperties": { "type": "integer" }
    },
    "providers": {
      "type": "array",
      "items": {
        "type": "object",
        "required": ["id", "file", "apiType"],
        "properties": {
          "id": { "type": "string" },
          "file": {
            "type": "string",
            "description": "Repo-relative path, e.g. providers/openai.json"
          },
          "apiType": { "type": "string" },
          "modelCount": { "type": "integer" },
          "freeModelCount": {
            "type": "integer",
            "description": "Models with costClass=free in this provider file (added in 1.1.0). Free-only catalog, so it equals modelCount."
          },
          "lastChecked": { "type": ["string", "null"] }
        },
        "additionalProperties": true
      }
    }
  },
  "additionalProperties": true
}
