{
  "schemaVersion": "1.4.0",
  "generatedAt": "2026-08-05T10:21:01Z",
  "totalModels": 360,
  "totalFreeModels": 360,
  "capabilitySummary": {
    "chat": 156,
    "json": 112,
    "streaming": 196,
    "tools": 41,
    "vision": 24
  },
  "providers": [
    {
      "id": "cerebras",
      "file": "providers/cerebras.json",
      "apiType": "openai-compatible",
      "modelCount": 3,
      "freeModelCount": 3,
      "lastChecked": "2026-08-02T08:23:07Z"
    },
    {
      "id": "cloudflare",
      "file": "providers/cloudflare.json",
      "apiType": "openai-compatible",
      "modelCount": 61,
      "freeModelCount": 61,
      "lastChecked": "2026-08-02T08:23:11Z"
    },
    {
      "id": "cohere",
      "file": "providers/cohere.json",
      "apiType": "openai-compatible",
      "modelCount": 31,
      "freeModelCount": 31,
      "lastChecked": "2026-08-02T08:23:07Z"
    },
    {
      "id": "gemini",
      "file": "providers/gemini.json",
      "apiType": "gemini",
      "modelCount": 44,
      "freeModelCount": 44,
      "lastChecked": "2026-08-02T08:23:06Z"
    },
    {
      "id": "groq",
      "file": "providers/groq.json",
      "apiType": "openai-compatible",
      "modelCount": 15,
      "freeModelCount": 15,
      "lastChecked": "2026-08-02T08:23:06Z"
    },
    {
      "id": "huggingface",
      "file": "providers/huggingface.json",
      "apiType": "openai-compatible",
      "modelCount": 130,
      "freeModelCount": 130,
      "lastChecked": "2026-08-02T08:23:08Z"
    },
    {
      "id": "mistral",
      "file": "providers/mistral.json",
      "apiType": "openai-compatible",
      "modelCount": 52,
      "freeModelCount": 52,
      "lastChecked": "2026-08-02T08:23:07Z"
    },
    {
      "id": "openrouter",
      "file": "providers/openrouter.json",
      "apiType": "openai-compatible",
      "modelCount": 17,
      "freeModelCount": 17,
      "lastChecked": "2026-08-02T08:23:05Z"
    },
    {
      "id": "pollinations",
      "file": "providers/pollinations.json",
      "apiType": "openai-compatible",
      "modelCount": 1,
      "freeModelCount": 1,
      "lastChecked": "2026-08-02T08:23:05Z"
    },
    {
      "id": "sambanova",
      "file": "providers/sambanova.json",
      "apiType": "openai-compatible",
      "modelCount": 6,
      "freeModelCount": 6,
      "lastChecked": "2026-08-02T08:23:08Z"
    }
  ]
}
